{
  "schema_version": 1,
  "construction_anchor": {
    "source_commit": "05ab7a2dfe814a14eeb925323f83a47de23ae2ac",
    "source_clean": true,
    "note": "Recovered baseline after container loss: anchor line rebuilt as 783d896 plus the ead5d77 eval fixes (blob-identical to the measurement control contract). The greedy interleave anchor artifact is pending an engine fix for the c4 decode_und batch abort and is declared absent until measured.",
    "pending_artifacts": ["sensenova_greedy_interleave_c4"],
    "artifacts": {
      "qwen3_sharegpt_r16": {
        "root": "artifacts/qualification/generation_runtime/reference/construction/05ab7a2dfe814a14eeb925323f83a47de23ae2ac/qwen3_sharegpt/uniserve_r16",
        "manifest_sha256": "166f3437b433eef8d14d4e73697b7ec96f1b4ac4a01b1f857450afaa22d52451"
      },
      "sensenova_t2i_c32": {
        "root": "artifacts/qualification/generation_runtime/reference/construction/05ab7a2dfe814a14eeb925323f83a47de23ae2ac/sensenova_mjhq_t2i/uniserve_c32",
        "manifest_sha256": "9c03f86ccdab45ab6e4ba2dadc8089912ea8bb3c1c26471d0fa931066bc15871"
      },
      "sensenova_i2t_c32": {
        "root": "artifacts/qualification/generation_runtime/reference/construction/05ab7a2dfe814a14eeb925323f83a47de23ae2ac/sensenova_beans_i2t/uniserve_c32",
        "manifest_sha256": "e41980a823263cbbb5fe5560804701365e647a8cc8bad2f63f119065d2919ab5"
      }
    }
  },
  "performance_reference": {
    "source_commit": "8c33a6fcc0cfc6da9e5a14a698b0efbba3e0c8f5",
    "source_tree": "df134b999e6f00dbd40d6397e3da4349d3a05881",
    "measurement_commit": "7b0028163a1529197931d7c6d86282b736f7b3a3",
    "measurement_tree": "6262b118199ddee119628a159317675f60df7dfb",
    "source_clean": true,
    "control_overlay": {
      "contract_commit": "ead5d774f5c52ca2f2b13938b0653d4a754d5e6e",
      "paths": [
        "scripts/run_benchmarks.py",
        "uniserve_eval/cli.py",
        "uniserve_eval/harness/comparison.py",
        "uniserve_eval/harness/core/client.py",
        "uniserve_eval/harness/metrics/common.py",
        "uniserve_eval/harness/metrics/stream.py",
        "uniserve_eval/harness/report.py",
        "uniserve_eval/profiles.json",
        "uniserve_eval/verify.py"
      ]
    },
    "qualified_gates": ["P1"],
    "pending_points": ["sensenova_default_travel"],
    "required_action": "matched_reference_measurement",
    "artifacts": {
      "qwen3_sharegpt_r16": {
        "root": "artifacts/qualification/generation_runtime/reference/performance/8c33a6fcc0cfc6da9e5a14a698b0efbba3e0c8f5/qwen3_sharegpt/uniserve_r16",
        "manifest_sha256": "7f588e196cac9e47637eb798e38cd7b2b2819289aefd93cdf1a28f9f48f3bfe4"
      },
      "sensenova_t2i_c32": {
        "root": "artifacts/qualification/generation_runtime/reference/performance/8c33a6fcc0cfc6da9e5a14a698b0efbba3e0c8f5/sensenova_mjhq_t2i/uniserve_c32",
        "manifest_sha256": "3d7bf982d8757f3f82b651ec849ed4ef3db17ea1128851dad35a6b06ef26c258"
      },
      "sensenova_i2t_c32": {
        "root": "artifacts/qualification/generation_runtime/reference/performance/8c33a6fcc0cfc6da9e5a14a698b0efbba3e0c8f5/sensenova_beans_i2t/uniserve_c32",
        "manifest_sha256": "362721a50ba4972605e260b73237098c69fe94934f1c0696fd14be3e97b85357"
      }
    }
  },
  "profile_anchors": {
    "sensenova_stochastic_interleave_c4": {
      "source_commit": "5a1538848aad017828f8995391efcff921ecce29",
      "source_tree": "34244e72b18edfb3f64f7266db643d463fce3a51",
      "benchmark_profile": "main",
      "group": "sensenova-uniserve-stochastic",
      "point": "sensenova_ueval_stochastic_interleave_uniserve",
      "load_case_set": "interleave_qualification",
      "load_case_id": "c4",
      "benchmark_definition_fingerprint": "61a87ed9c2a24f0b5256d3535f2aa82ae0253f21d9b0ddf711dfc534f1668c64",
      "artifact_root": "artifacts/qualification/generation_runtime/reference/sensenova_ueval_stochastic_interleave/uniserve_c4",
      "status": "pending_measurement"
    }
  }
}
